{
  "stage_id": "INFRA-OPS-VERIFIED-TRUTH-FREEZE-2026-05-14",
  "risk_class": "AP-R1",
  "authority_impact": "AI-1",
  "task_type": "current_truth_cleanup",
  "template_id": "ordivon-closure-receipt-v1",
  "timestamp": "2026-05-14T14:20:00Z",
  "head_commit": "7070f2f1576cd3c81c5680d276435efa39a62f05",
  "files_changed": [
    "AGENTS.md",
    "docker-compose.infrastructure.yml",
    "docker-compose.infrastructure-mirror.yml",
    "docs/ai/README.md",
    "docs/ai/current-phase-boundaries.md",
    "docs/architecture/infrastructure-vision.md",
    "docs/governance/dependency-audit-debts.jsonl",
    "docs/governance/document-registry.jsonl",
    "docs/governance/receipts/infra-ops-verified-truth-freeze-2026-05-14.json"
  ],
  "verification_results": [
    {
      "id": "health-check",
      "description": "Infrastructure health check: postgres/nats/temporal/openfga/minio all healthy",
      "command": "python3 scripts/health_check.py",
      "passed": true,
      "exit_code": 0,
      "output_hash": "1c5280c6ce9f5c24"
    },
    {
      "id": "verify-infrastructure",
      "description": "PG query returned 102 registry entries; NATS publish, Temporal RPC, OpenFGA model/tuple, OPA transition, integration tests",
      "command": "PYTHONPATH=.:src .venv/bin/python scripts/verify_infrastructure.py",
      "passed": true,
      "exit_code": 0,
      "output_hash": "bb5e9cdc72d461c1"
    },
    {
      "id": "document-registry",
      "description": "Document registry invariants pass after infra truth freeze metadata update",
      "command": "PYTHONPATH=.:src .venv/bin/python scripts/check_document_registry.py",
      "passed": true,
      "exit_code": 0,
      "output_hash": "2a4671c56a7183ba"
    },
    {
      "id": "path-map",
      "description": "Path map generation reports zero blocked files; registered debt remains debt-parked",
      "command": "PYTHONPATH=.:src .venv/bin/python scripts/update-path-map.py",
      "passed": true,
      "exit_code": 0,
      "output_hash": "ba58eba838c5ce38"
    },
    {
      "id": "coverage-boundary",
      "description": "Coverage boundary generation reports zero blocked files and does not claim full closure",
      "command": "PYTHONPATH=.:src .venv/bin/python scripts/update-coverage-boundary.py",
      "passed": true,
      "exit_code": 0,
      "output_hash": "7556fea23f8c2ee3"
    },
    {
      "id": "ordivon-verify",
      "description": "Trust summary returns READY_WITHOUT_AUTHORIZATION",
      "command": "PYTHONPATH=.:src .venv/bin/python -m ordivon_verify all --summary",
      "passed": true,
      "exit_code": 0,
      "output_hash": "c2d8ba449386b530"
    }
  ],
  "boundary_violations": [],
  "evidence_produced": [
    {
      "type": "command_output",
      "path": "docs/governance/receipts/infra-ops-verified-truth-freeze-2026-05-14.json",
      "hash": "bb5e9cdc72d461c1"
    },
    {
      "type": "registry_diff",
      "path": "docs/governance/document-registry.jsonl",
      "hash": "2a4671c56a7183ba"
    }
  ],
  "closure_predicates": [
    {
      "id": "infra-status-current-truth-updated",
      "satisfied": true,
      "evidence_ref": "docs/ai/current-phase-boundaries.md"
    },
    {
      "id": "ops-smoke-path-verified",
      "satisfied": true,
      "evidence_ref": "scripts/verify_infrastructure.py"
    },
    {
      "id": "ready-without-authorization-preserved",
      "satisfied": true,
      "evidence_ref": "PYTHONPATH=.:src .venv/bin/python -m ordivon_verify all --summary"
    },
    {
      "id": "docs-coverage-debt-remains-open",
      "satisfied": true,
      "evidence_ref": "docs/governance/dependency-audit-debts.jsonl"
    }
  ],
  "authorization": {
    "status": "not_requested",
    "rationale": "READY_WITHOUT_AUTHORIZATION only; no merge, release, deploy, policy activation, broker write, or external action authorized."
  },
  "overall": "READY",
  "notes": "INFRA-2/3 promoted only to ops-verified smoke path based on 2026-05-14 local evidence. Broader workflow durability, evidence blob integration, and AI observability remain future work. The docs coverage debt DEP-DOC-COVERAGE-BLOCKED-2026-05-14 remains OPEN."
}
